id,txt
1, tsoh8 jit8 tsu7 huat4 sing3 tsip8 kiat4 ti7 hing5 tsing3 inn7 tua7 mng5 khau2 tsing5 ， 
2, tsing3 ti7 ui1 hik4 khi3 hun1 ham5 kiong5 se3 e5 ui5 too2 ， 
3, tsue3 kin7 nng7 sann1 koo3 gueh8 i2 lai5 ， 
4, tiong1 kok4 kok4 bin5 tong2 e5 lip8 ui2 kap4 mia5 tshui3 tak8 kang1 ti7 tian7 si7 ting2 thoo3 lian5 hok8 ， 
5, lam7 sam2 khai1 hong3 
6, kau3 tiunn5 kuan1 le2 ， 
7, hak8 sing1 ham5 bin5 tsin3 tong2 u7 khan1 lian5 ， 
8, tsing5 tsu3 jit8 tai7 piau2 khoo2 se3 khai2 ， 
9, king1 lik8 ji7 tsap8 ni5 tsau2 tshue7 ， 
10, iah8 si7 phian3 soo2 kong2 e5 sann1 pah4 lang5 ， 
11, Badai si7 khun3 ti7 it4 kiu2 liok8 ji7 ni5 goo7 gueh8 tsap8 goo7 ho7 tshut4 se3 。 
12, ti7 hua5 huat4 khi2 e5 tsu7 sat4 kong1 kik4 tiong1 hian3 sin1 song3 bing7 ， 
13, tsing3 bing5 tsia1 e5 hue3 khi3 kau3 thang1 ti3 su2 jin5 lui7 hoo1 khip4 he7 thong2 tsing3 thau5 、 
14, bi2 kok4 tsue3 ko1 huat4 inn7 tsap8 goo7 ho7 tshai5 ting7 ， 
15, thau5 pai2 phai3 tsu7 hai2 gua7 ， 
16, bin5 tsiong3 tui3 lak8 ho7 e7 poo1 pau1 ui5 tan5 hun5 lim5 hioh4 khun3 e5 inn5 suann1 png7 tiam3 liau2 au7 ， 
17, m7 koh4 tsit8 e5 siang7 tshu3 bi7 e5 sin1 bun5 ， 
18, tshiong1 sing7 tsit8 si5 e5 「 peh8 kim1 sue3 guat8 」 san2 giap8 。 
19, kai2 iong7 thih4 loo7 kau1 thong1 ui5 tsu2 。 
20, i1 kong2 ， i1 kan1 ta1 u7 tsit4 ui7 a1 hiann1 ， 
21, ke1 siu1 e5 hui3 iong7 long2 e7 tang3 the3 hing5 ， 
22, Obama sin1 tsing3 hu2 beh4 ke3 siok8 bi2 kok4 guan5 u7 e5 tui3 tai5 tsing3 tshik4 ， 
23, tau3 tsiok4 nng7 tiam2 goo7 ik4 ， 
24, tsuan1 bun5 tsiam1 tui3 tai5 uan5 phai3 ham5 bin5 tsin3 tong2 jin5 su7 ， 
25, li7 iong7 ko3 jin5 ui1 bong7 soo2 thui1 tshut4 e5 tsing3 tshik4 ， 
26, li2 khing3 an1 kok4 tsik8 bun7 te5 tshua3 ing1 bun5 piau2 si7 kau2 pian7 un2 mua5 tsing1 huan2 kam2 
27, ji7 ji7 pat4 ki3 liam7 jit8 beh4 kau3 ， 
28, gin2 a2 lau7 pe7 tsai1 iann2 hau7 senn1 thau1 theh8 au7 ， 
29, ki3 liam7 tsit8 ui7 tiong7 iau3 e5 tai5 uan5 tsok4 ka1 ， 
30, tiong1 kok4 kok4 bin5 tong2 beh4 tsioh4 tioh8 tan5 tsui2 pinn2 e5 an3 kiann7 ， 
31, lip8 huat4 inn7 siann2 ma7 bian2 siunn7 beh4 tong7 。 
32, i2 king1 king1 kue3 liau2 nng7 le2 pai3 ， 
33, ki5 tiong1 sui7 tian2 tsu2 kong1 si1 Saab ， 
34, ka1 jip8 「 gua7 ke1 」 ian2 tshut4 i2 lai5 ， 
35, bin5 si7 sin1 bun5 sia7 iau7 tik4 ko1 hiong5 tshi7 po3 to7 
36, sim7 tsi3 pi2 phua3 penn7 tsing5 iau2 khah4 ho2 ！ 」 
37, kiu3 king3 si7 the3 tai5 uan5 suan1 thuan5 ， 
38, li2 tsai1 iann2 tai5 uan5 te7 it4 ui7 ， 
39, in1 tsah4 tioh8 tshiong1 thian1 phau3 be7 phau3 hong1 ， 
40, kin1 a2 jit8 khi2 kau3 sann1 gueh8 ji7 tsap8 goo7 ho7 ， 
41, tsap8 peh4 ho7 i1 tsuan1 kang1 lai5 kau3 tai5 uan5 ， 
42, 「 sui1 jian5 ， jit8 pun2 e5 ＭＤ kun1 tsin3 tsing5 sit8 giam7 sing5 kong1 kue3 ， 
43, phainn7 tioh8 ue7 sing1 huat4 po3 khi3 e5 lam5 loo7 ing1 ， 
44, tai5 uan5 ti1 bing5 gak8 thuan5 「 siam2 ling5 」 ， 
45, tsan1 king1 ing5 hik8 bun5 kian3 hue7 piau2 iong5 ， 
46, thau5 ke1 ka7 kang1 tiunn5 thiah4 tiau7 ， 
47, lian5 sua3 ti7 tsuan5 kiu5 khok4 san3 ， 
48, su2 iam7 bun5 tai7 tsian3 tsong3 kiann3 jin5 e5 hi3 tshut4 ， 
49, tso7 sing5 「 peh8 thau5 khok4 a2 」 e5 tsap8 phue3 ui1 hiap8 ， 
50, tsa2 i2 king1 tsin3 hing5 kuan2 tse3 ， 
51, si7 tsit4 ma2 tsiu7 thok8 tai5 tiong1 kau3 iok8 tai7 hak8 ， 
52, ka1 gi7 kuan7 tiunn2 tan5 bing5 bun5 ti7 tai5 thng5 khong1 te7 ， 
53, kho2 ling5 si7 iong7 lai5 tsu2 sit8 but8 e5 tsiah8 png7 thiann1 ， 
54, bin5 si7 sin1 bun5 po3 to7 
55, ji5 tshiann2 kho2 ling5 ai3 kau3 kin1 ni5 te7 si3 kui3 ， 
56, iap4 kim1 tshuan1 iau2 khi3 kau3 tua7 bak8 kim1 kim1 khuann3 ， 
57, pau1 kuat4 tsit8 kua2 mui5 the2 ko3 i3 tiam2 hue2 、 sam3 tang7 ， 
58, lo5 kang1 thuan5 the2 thong3 phue1 ma2 ing1 kiu2 ， 
59, tshe1 tsiat4 kap4 tsuat4 bong7 ， 
60, tshe1 lah4 lah4 sann1 a2 ， 
61, in1 ui7 gua7 hing5 sio1 kang7 ， 
62, tan7 si7 thai3 too7 kiong5 nge7 ， 
63, tsng2 thau5 a2 put4 tuan7 moo5 tshat4 ， 
64, u7 tua7 phe1 bin5 tsiong3 kiann5 tsiunn7 ke1 thau5 ， 
65, kin1 tsio1 sin1 ke3 ah4 si7 tit4 tit4 loh8 ， 
66, ping7 tshiann2 phah4 tian7 ue7 po3 king2 。 
67, ti7 tai5 lam5 ing2 khang1 tiam3 e5 khai1 bo7 uah8 tang7 ， 
68, kue2 long5 ui7 tioh8 pik4 kuann2 o1 su5 a2 tiam2 bang2 a2 hiunn1 ， 
69, in1 tshu2 ， 
70, to1 huat4 hian7 sin3 ho7 koh4 iunn7 ， 
71, go7 gueh8 hun7 ti7 au7 khin5 hak8 hau7 tam1 jim7 tua7 tui7 tiunn2 si5 tsun7 ， 
72, kian3 a2 pun2 kui3 iah4 the5 tsa2 kiat4 sok4 ， 
73, lian5 jit8 lai5 e5 tua7 juah8 thinn1 ， 
74, to1 e7 sai2 tsiah8 tioh8 an2 ne1 e5 tsai7 te7 bi7 。 
75, ti7 tiong1 kok4 ham5 pak4 han5 pinn1 kai3 tshai2 hong2 si5 ， 
76, tshe1 hong1 thai1 tua3 lai5 kiong5 hong1 tua7 tsui2 hoo7 ， 
77, tshoo1 poo7 kuat4 ting7 ， 
78, ka7 bi2 tsiu2 phun3 ti7 hioh8 a2 bin7 ting2 ， 
79, pau1 kuat4 kok4 kun1 kap4 gi7 kang1 thuan5 the2 ， 
80, kin1 ki3 khi3 siong7 u7 po3 tsu1 liau7 hian2 si7 ， 
81, tsiong1 hua3 khe1 oo5 kue2 tshai3 tshi7 tiunn5 i7 koo2 ， 
82, king1 kue3 tsap8 gua7 ni5 lai5 ， 
83, kap4 nng7 tiau5 tiau5 sio1 kiat4 hap8 。 
84, giam5 le7 phe1 phuann3 sit8 si1 ui1 kuan5 thong2 ti7 e5 tiong1 kok4 kok4 bin5 tong2 tong1 kiok8 ， 
85, hoo7 i1 kam2 kak4 tsin1 un1 luan2 ， 
86, tsha2 png7 ti7 ko1 a2 kap4 khong1 tiong1 lai5 lai5 hue5 hue5 ， 
87, kin1 ni5 han5 tang1 ， 
88, tshuan1 bin5 tsu7 tsip8 tai5 tian7 kong1 si1 lai7 tam5 phuann3 ， 
89, le2 kim1 ham5 ham5 mi5 phue7 ting2 jit8 iong7 phin2 ， 
90, tshe1 tai7 hak8 liong2 gan7 bun7 te5 tsuan1 ka1 tsiu1 tik4 、 
91, ma2 siang7 jim7 au7 kam3 thiann1 liang7 pi2 i2 tsing5 kiam2 tsio2 ， 
92, giap8 tsia2 khah4 tam1 sim1 koh4 thinn1 sin1 siong1 ， 
93, au7 bin7 khia5 1oo7 1too1 1bai2 e5 lang5 tsin3 tsing5 tsit8 khuann3 ， 
94, ti5 liau2 bok8 ge7 tsok4 phin2 ， 
95, m7 koh4 pat4 pat4 tsui2 tsai1 e5 tiong5 kian3 tsi1 loo7 ， 
96, sam1 lip8 sin1 bun5 tai5 
97, tong5 hak8 tsok4 giat8 phuah4 sio1 tsui2 kok4 sio2 sing1 thng3 siong1 
98, koh4 pang2 hue2 ka7 niau2 tshi2 uah8 uah8 sio1 si2 ， 
99, bak8 kik4 tsia2 piau2 si7 ， 
100, kam2 kong2 si7 khua3 khu1 moo1 hui1 ， 
101, bok8 tsing5 bo5 tsik4 si5 ui1 hiap8 ， 
102, kok4 tiong1 sing1 siau1 hui3 siong5 sik4 pah4 hun1 tsi1 ji7 tsap8 it4 tiam2 tshit4 bo5 kip8 keh4 
103, lu2 lai5 lu2 tse7 e5 nng2 the2 kho1 ki1 giap8 tsia2 ， 
104, e7 sai2 khin1 i7 tuat8 tsau2 tsit8 e5 lang5 e7 senn3 mia7 。 
105, e7 tai3 tong7 tai5 uan5 im1 gak8 san2 giap8 e5 sin1 khi3 siong7 。 
106, tsap8 it4 gueh8 tsap8 tshit4 ho7 lau5 iu7 sin5 tng2 kau3 kok4 mng5 ， 
107, Rabiye ki3 lok8 phinn3 tai5 pak4 tshi7 gi7 hue7 pok8 mua2 
108, thuan5 tshut4 u7 ioh8 kiok8 huan3 be7 ke2 pai5 e5 ， 
109, tai5 pak4 tshi7 gi7 uan5 tsng1 sui7 hiong5 ， 
110, thinn1 khi3 ling2 ， tshiong1 kik4 tioh8 e5 ， 
111, ku7 ni5 e5 tsap8 gueh8 ， 
112, long5 bin5 khi3 hun3 tsuan5 poo7 to2 jip8 tai7 kah4 khe1 ， 
113, pi7 ku7 kim1 suann1 tsit8 tui3 tua3 tua7 tshu3 theh8 e5 lau7 ang1 a2 boo2 tsi2 ting7 siu1 iang2 ， 
114, pian3 tsong1 lai5 kau3 hing5 tsing3 inn7 mng5 khau2 khong3 gi7 。 
115, tai5 phai3 thuan5 the2 i2 kip8 huat4 lun5 kong1 ting2 ， 
116, siang7 giam7 tiong7 tsiong3 e7 ti3 si2 ！ 
117, sit8 tsai7 si7 in1 ui7 pi7 pik4 kau3 bo5 loo7 kho2 the3 ！ 
118, kiat4 ko2 i1 e5 ping5 iu2 king3 jian5 su1 tsu7 to7 nia2 tshai2 kim1 ， 
119, tsiah4 e7 tsing1 ka1 tsing3 tsu1 i3 guan7 。 
120, sam1 lip8 sin1 bun5 tai5 
121, siong7 su1 iau3 su2 iong7 e5 tsut8 bi2 ， 
122, pau1 tsong1 long2 si7 tiong1 kok4 kan2 the2 ji7 。 
123, kiu3 uan7 hing5 tong7 ko3 tsit8 tuann7 loh8 ， 
124, u7 giap8 tsia2 ka7 siong5 tsi2 a2 kai2 sing5 Hawaii sik4 tsian3 ， 
125, phian1 phian1 hu3 kin7 e5 kong1 kiong7 kian3 siat4 bun7 te5 tsit8 tua7 tui1 ， 
126, pang7 kiu5 pi7 tshing1 tso3 kok4 kiu5 ， 
127, iau1 kiu5 tsui2 li7 su2 sui5 thing5 kang1 。 
128, kai2 tso3 「 ki3 liam7 」 ， 
129, i2 king1 tiau3 uat8 kam3 si7 khi3 tsuan5 lik8 tui1 tsa1 。 
130, am3 si5 lak8 tiam2 gua7 huat4 sing1 hue2 sio1 ， 
131, hue2 si3 sann1 tsap8 hun1 tsing1 au7 khong3 tse3 ， 
132, sam1 lip8 sin1 bun5 tai5 
133, tsit4 lui7 e5 tian7 tong7 tshia1 ， 
134, tan7 si7 kiu3 hoo7 tshia1 gai7 i5 kui1 ting7 ， 
135, sam1 lip8 sin1 bun5 tai5 
136, hoo7 tit4 ian5 huann7 tsit8 phinn3 boo5 bang5 bang5 ， 
137, ian5 kue1 sia7 kng3 tsu1 sann1 king1 tiam3 thau5 po1 le5 tsiah8 soo1 
138, ki5 tshu3 si7 lam5 han5 ， 
139, tam1 hong1 loo7 tuann7 si7 ti7 kok4 to7 sann1 ho7 sann1 tiam2 it4 kong1 li2 tshu3 ， 
140, iu5 tsinn5 tioh8 sing1 tsu7 iam1 te7 a2 sua1 tsioh8 a2 tshia1 un3 tsiang3 kik4 pa7 kang1 
141, tai5 tang1 be7 tshai3 a1 ma2 tan5 tshiu7 kiok4 ， 
142, kui1 tai5 tshia1 si3 lian2 hiong3 thinn1 ， 
143, tsit4 si7 ti7 tai5 tiong1 hui1 siong5 ti1 bing5 e5 hoo7 kok4 tshing1 liang5 si7 。 
144, u7 nng7 tsiah4 tai5 uan5 oo1 him5 ， 
145, tsap8 it4 hue3 e5 senn3 ong5 tsa1 boo2 gin2 a2 ， 
146, lip8 me5 au7 lui5 kong1 hoo7 bo5 thing5 ， 
147, kiann5 kau3 phian1 phiah4 am3 hang7 a2 liau2 au7 ， 
148, sam1 lip8 sin1 bun5 tai5 
149, lak8 gueh8 lak8 ho7 e7 poo1 huat4 sing1 tsit8 khi2 i3 gua7 ， 
150, tso7 sing5 tong1 si5 tu2 ti7 tsin3 hing5 tian7 sin3 kang1 ting5 e5 nng7 mia5 kang1 lang5 ， 
151, huat4 sing1 hue2 sio1 ki1 tshia1 i3 gua7 ， 
152, lian5 khin5 su1 ling7 poo7 tu2 ka1 kin2 tshai2 kang2 tsok4 giap8 。 
153, king2 hong1 tsiong1 pi7 hai7 jin5 kiu3 tshut4 si5 ， 
154, poo2 sip8 pan1 tsiunn7 pah4 mia5 hak8 tong5 lai7 te2 ， 
155, am7 a2 king2 pi7 sing1 kang3 thui1 ham5 thian1 pong5 tsam2 tng7 ， 
156, bok8 tsing3 kiam1 sue3 tsiann5 tso3 thng5 jio7 penn7 ping3 huat4 tsing3 e5 thau5 ， 
157, tsu7 iu5 si5 po3 po3 to7 
158, tshia1 ho7 huat4 sing1 ti7 tai5 uan5 si5 kan1 tsap8 peh4 ho7 ， 
159, suah4 huainn5 pa3 e5 kiong5 nge7 ting1 siu1 long5 te7 ， 
160, kong2 tshut4 i1 lai7 sim1 e5 siunn7 huat4 ， 
161, ko1 ting2 huat4 inn7 e5 huat4 gian5 jin5 kai2 sik4 ， 
162, tai5 tang1 tsit4 ma2 khiam3 khuat4 bah4 ti1 khiam3 kah4 tsin1 hiong1 ， 
163, tshong3 ha7 ji7 tsap8 sann1 koo3 gueh8 i2 lai5 e5 sin1 kuan5 ke3 。 
164, sui1 jian5 ti7 kuan3 a1 kun1 pi2 sai3 sit4 li7 ， 
165, tak8 ke1 long2 hi1 bang7 tong5 uan2 tseh4 ke3 siok8 pan7 loh8 khi3 ， 
166, m7 koh4 ko1 a2 piann2 e5 guan5 but8 liau7 pau1 kuat4 gu5 ling1 hun2 、 ling1 iu5 、 
167, tsit4 ping5 si7 sua1 poo1 phu5 hian7 ， 
168, ka1 tsui2 tsam7 hue3 tsui2 koh4 hue5 siu1 tsiat4 iok4 ai3 tue7 kiu5 
169, kam2 kak4 tsin1 m7 kam1 tit4 ， 
170, tui7 uan5 loo5 tsun3 hong5 iong7 tsit8 tiam2 gua7 tsing1 e5 si5 kan1 ， 
171, tui3 pian7 soo2 pinn1 e5 pinn1 kak4 hinn3 sak4 ， 
172, si3 pah4 si3 tsap8 goo7 phit4 be2 tse7 hui1 ki1 tshong3 ha7 khong1 un7 ki3 lok8 
173, i1 li7 iong7 tong1 te7 sing1 san2 e5 kiunn1 ， 
174, i2 king1 ti7 ji7 tsap8 goo7 ho7 to2 tng2 tiong1 kok4 ， 
175, tsing5 tai5 pak4 tshi7 sin1 kian3 kang1 ting5 tshu3 tiunn2 ng5 siah4 hun1 ， 
176, ui7 ti7 ka1 gi7 kuan7 thai3 po2 hiong1 e5 tai5 sok4 lam5 a1 sok4 ka1 tshiunn2 huat4 sing1 hue2 sio1 ， 
177, ki5 tiong1 u7 lak8 lang5 si7 in3 ni5 tsik8 e5 gua7 lo5 ， 
178, bin5 si7 sin1 bun5 po3 to7 
179, bin5 si7 sin1 bun5 po3 to7 
180, sim7 tsi3 ti7 ji7 khong3 it4 khong3 ni5 iau2 thui1 tshut4 liau2 iu5 koo3 bak8 liok8 ， 
181, ti7 ji7 tsap8 ho7 kong1 poo3 tsai5 tsing3 sok4 an5 ke3 ue7 ， 
182, him1 siong2 am3 poo1 a2 si5 tsun7 e5 sai1 tsiau3 jit8 ， 
183, tsit8 ng5 tsit8 ang5 siong7 ting1 ping5 an1 tsiok4 hok4 ， 
184, tai5 tiong1 tshi7 tiunn2 oo5 tsi3 kiong5 tiau3 boo7 tsi3 kang1 e5 te2 phinn3 ， 
185, bin5 si7 sin1 bun5 po3 to7 
186, mui2 ni5 long2 e7 tshong3 tso7 kho2 kuan1 e5 gua7 siau1 ing5 siu1 ， 
187, li2 sin1 senn1 theh8 tshut4 tsit8 thah8 huat8 tuann1 to1 kau7 kau3 tsap8 kong1 hun1 ， 
188, tsi3 i5 sia7 khu1 ui7 ho5 kik4 liat8 huan2 ing3 ai3 bun7 tui3 hong1 ， 
189, ti7 ang5 te5 e5 koo3 hiong1 jit8 guat8 tham5 pinn1 a2 tsin3 hing5 ， 
190, thiok4 san2 hue3 khi3 but8 tshu2 li2 kap4 u1 jiam2 hong5 ti7 ， 
191, sui1 jian5 khai1 liau2 be7 tsio2 tsinn5 be2 mih8 kiann7 ， 
192, tsu7 an2 ne1 bi2 kok4 hi1 bang7 tsin7 khuai3 khue1 hok8 siang1 ping5 tui3 ue7 。 
193, tai5 uan5 e5 la7 pue1 po2 iok8 kang1 tsok4 u7 sing5 ko2 ， 
194, tso1 khui1 tshing3 phah4 tioh8 tsiann3 hing1 kham2 e5 li2 tiam3 uan5 tan5 phin2 iong5 ， 
195, tshik4 a2 e5 sing1 san2 liang7 tsiam3 liau2 tsuan5 tai5 uan5 sann1 hun1 tsi1 it4 ， 
196, si3 tsap8 it4 hue3 senn3 tiunn1 tsa1 poo1 goo7 ni5 tsian5 lai5 kim1 mng5 tso3 suann3 kang1 ， 
197, kin1 ni5 pi2 ku7 ni5 tong5 ki5 ke1 liau2 tsit8 ban7 siunn1 ke1 nng7 ， 
198, tsiong1 hua3 ki1 tok4 kau3 penn7 inn7 hu3 inn7 tiunn2 tsiu1 hian5 tsiong1 kong2 ， 
199, beh4 ua2 lak8 tsap8 ji7 ban7 lang5 tsi1 tshi5 ， 
200, khui1 tshia1 kap4 loo7 kue3 e5 bin5 tsiong3 kiau7 tshia1 tui3 long3 huat4 be7 tong7 ， 
201, put4 tuan7 ti7 bi2 kok4 kok4 hue7 iu5 suat4 ， 
202, khong1 kun1 su1 ling7 lui5 giok8 ki5 tshin1 tsu7 tshut4 bin7 suat4 bing5 ， 
203, tse7 kong1 bu7 tshia1 hoo7 su1 ki1 ka1 pan1 tsian5 ong2 hun1 le2 hue7 tiunn5 ， 
204, bin5 si7 sin1 bun5 po3 to7 
205, ki5 tiong1 iau2 u7 tshiau1 kip4 han2 kian3 e5 ting2 kip4 gu5 tsiang1 koo1 ， 
206, tsian5 ong2 ko1 hiong5 tshi7 e5 sam1 hong7 tiong1 ke1 kap4 tua7 be7 tiunn5 kiam2 tsa1 ， 
207, bin5 si7 sin1 bun5 po3 to7 
208, ki3 tsia2 tshin1 sin1 the2 giam7 ma7 huat4 hian7 ， 
209, kang1 kok4 khing3 lau7 bo2 tit4 tsai1 siau1 sit4 ， 
210, uat8 lam5 kin1 ni5 e5 sing1 sio1 u7 tam7 poh8 ki5 kuai3 ， 
211, khia7 ke1 iau3 san3 kau3 pi7 tng7 tsui2 tuan7 tian7 ， 
212, khah4 hoo7 lang5 tam1 sim1 e5 si7 ， 
213, phenn5 oo5 e5 hai2 le7 a2 iu5 tsi1 hong1 kau7 ， 
214, tsiah4 e7 tso3 te7 it4 e5 sue5 kang3 e5 lang5 tsham2 gu7 siak4 si2 ， 
215, m7 koh4 a1 hiann1 khip4 jip8 kue3 to1 it4 iong2 hua3 thuann3 sin1 bong5 。 
216, lu2 tsu2 ko1 ni2 hu1 kiu5 siang7 sin1 e5 se3 kai3 pai5 mia5 ， 
217, tui1 su1 ji7 ji7 pat4 ka1 siok8 phe1 ma2 ing1 kiu2 sng2 nng7 bin7 tshiu2 huat4 
218, si5 kan1 iau2 be7 hu2 ping5 siunn1 tshui3 ， 
219, ti7 kun1 hong1 hue2 phau3 sia7 kik8 liau2 au7 ， 
220, bi7 lai5 na7 tsun2 ting3 be7 tioh8 phio3 ， 
221, tsit4 pe2 hue2 sio1 tshut4 tai5 tiong1 tshi7 tiunn2 oo5 tsi3 kiong5 e5 tsing3 ti7 gui5 ki1 ； 
222, sui1 jian5 ki1 tai5 siat4 pi7 siu7 tioh8 ing2 hiang2 ， 
223, khak4 sit8 be7 sai2 bo5 tshui3 am1 e5 su1 kiu5 。 
224, tshua3 ing1 bun5 ti5 liau2 suan1 se3 kong1 kiong7 kian3 siat4 e5 tsip4 hing5 lik8 ， 
225, kuan3 tse3 tshiau1 kue3 tsit8 tshing1 siu2 kua1 khik4 ， 
226, ku2 hing5 lip8 ui2 tsham1 suan2 jin5 e5 thui1 tsian3 tai7 hue7 ， 
227, ling7 gua7 iau2 u7 kue3 loo7 lang5 thian1 kio5 ， 
228, tsap8 lak8 ni5 tsing5 e5 tsiu1 lang5 phian3 tian7 tong7 pe3 an3 ， 
229, tiam3 thau5 giap8 tsik4 ke1 liau2 kui2 na7 siann5 ， 
230, iau1 kiu5 「 hak8 sing1 hak8 ah4 bi5 kiann5 loo7 」 the2 huat8 hak8 sing1 ， 
231, tsit4 ma2 ing1 kai1 tua7 kau3 tsit8 e5 lang5 e5 io1 too7 tso2 iu7 ， 
232, poo1 li2 tin3 tioh8 si7 un7 iong7 sing1 but8 hong5 ti7 hong1 sik4 ， 
233, si7 te7 ha7 tsui2 siam3 thau3 kap4 giam5 tiann7 senn1 sian1 ， 
234, tsit8 kua2 i1 sing1 、 inn7 tiunn2 long2 u7 pue5 tsiah8 png7 hang5 tsing5 ， 
235, tso3 uann7 be7 kai2 ti5 bin5 sing1 iong7 tsui2 an5 khang1 ， 
236, tsap8 lak8 ho7 khai1 si2 ku2 pan7 「 po2 sing1 bun5 hua3 tse3 」 e5 tua7 hing5 uah8 tang7 ， 
237, lang5 kheh4 ma7 tue3 loh8 puann1 ， 
238, mue2 kang1 hue5 siu1 tsit8 tshing1 tong3 ke3 sng3 ， 
239, soo2 kong2 e5 mih8 i2 hi1 ui5 kui3 ， 
240, put4 ko3 tsu2 kuan2 ki1 kuan1 long5 ui2 hue7 tsu2 ui2 tan5 bu2 hiong5 ， 
241, tsa3 ioh8 kang1 tiunn5 pian3 iam2 tai5 tiunn5 bin5 tsiong3 hun3 noo7 khong3 gi7 
242, bin5 si7 sin1 bun5 po3 to7 
243, m7 koh4 tsiau1 pai5 ting2 tsia1 e5 ji7 ， 
244, beh4 ing7 kua1 siann1 tshiunn3 tshut4 tui3 bo2 tshin1 e5 tsiok4 hok4 ， 
245, sui1 jian5 pinn1 a2 u7 tsit8 e5 hu7 jin5 khuann3 koo3 i1 ， 
246, koh4 an3 tsiau3 ka1 siang7 「 sok4 sim2 huat4 」 kui1 ting7 ， 
247, tai7 iok4 ling5 tiam2 sann1 sann1 ping5 hong1 kong1 tshioh4 sann1 kak4 hing5 ki5 ling5 te7 ， 
248, sun2 sit4 ma7 phainn2 koo2 ke3 。 
249, khiong2 kiann1 e7 ting5 puann1 kian3 sing5 inn5 khuan5 lau7 tann3 a2 siong1 sua2 tshut4 ， 
250, tsit4 tah4 e5 hi5 bo5 bun7 te5 。 
251, hau7 hong1 huai5 gi5 bun7 te5 kho2 ling5 tshut4 ti7 tshan1 ap8 e5 he7 bin7 。 
252, i1 bo5 i3 gua7 ， m7 koh4 e7 it4 tit8 sun5 sun5 sian7 iu2 。 
253, in1 ui7 kap4 tshi7 tsing3 hu2 kiam2 ki2 liau2 kui2 na7 pai2 ， 
254, goo7 gueh8 tsap8 peh4 ho7 lian5 sua3 tua7 hue2 ， 
255, sann1 mia5 kiu3 lan7 gi7 kang1 ho2 un7 hik8 kiu3 ， 
256, khia5 ki1 tshia1 ti7 tshia1 loo7 ting2 ， 
257, ti7 tik4 kho1 kang1 tsok4 e5 kiong2 sin1 senn1 ku7 ni5 tsap8 gueh8 thiu1 tsiong2 hik8 tit4 ， 
258, tsit4 mia5 te7 it4 pai2 lai5 tai5 uan5 e5 Ireland tsik8 tshing1 lian5 ， 
259, gi5 su7 tu2 tioh8 niau2 tshi2 ge3 khe3 ， 
260, sang3 i1 au7 long2 i2 king1 bo5 tua7 gai7 。 
261, to1 ti7 i1 kiann5 kue3 tshia1 loo7 e5 kui2 biau2 tsing1 liau2 au7 ， 
262, ji7 pang5 tsa1 boo2 kiann2 tiunn1 kho2 him1 ， 
263, kiong5 tiau7 the3 khuan2 liau2 au7 to1 e7 kui1 huan5 ， 
264, ka7 kiau7 tshia1 sua2 khui1 。 
265, sann1 pah4 gua7 tsiong2 kuan1 siong2 hi5 ， 
266, sann1 tsenn1 tso3 tsit4 koo2 kim1 kong1 jiat8 tiau5 ， 
267, bin5 si7 sin1 bun5 po3 to7 
268, tshit4 tsap8 sann1 hue3 e5 siau1 thai3 jian5 tshut4 si3 ti7 ko1 hiong5 ， 
269, lak8 gueh8 tiong1 tsiah4 khui1 kue3 to1 ， 
270, tan5 bun5 sing5 phok4 su7 kue3 ong2 i2 king1 mua2 sann1 tsap8 tsiu1 ni5 0ah4 ， 
271, ma2 siang7 uat4 jip8 kim3 tsi2 1oo7 1too1 1bai2 hing5 su2 e5 ko1 ke3 to7 loo7 ， 
272, bin5 si7 sin1 bun5 po3 to7 
273, sui1 jian5 i1 e7 poo1 i2 king1 ka1 ki7 tau5 an3 ， 
274, tsham1 jip8 png7 tshai3 lai7 hiam2 hiam2 jia2 sing5 jin5 bing7 ， 
275, tui3 kui7 tai5 sio2 tsia2 tshiu2 tiong1 tsiap4 kue3 bok8 kue1 ， 
276, lu2 tsu2 it4 tsai3 tshue7 li2 iu5 bo5 hu3 tsinn5 ， 
277, siang7 bue2 sin1 kang2 hiong1 hiong1 tiunn1 tshut4 bin7 tsiap4 siu7 bin5 tsiong3 tin5 tsing5 ， 
278, na7 tsun2 beh4 pi7 bian2 tshu3 pi7 lui5 kha3 tioh8 ， 
279, bi2 hun2 thng1 e5 thng1 thau5 phang1 tinn1 kau7 tak4 tak4 ， 
280, khak4 ting7 long5 hue7 si7 kiu1 tsui2 pan2 e5 liang7 tau2 ， 
281, sim1 lai7 kam2 kak4 pi7 bu2 jiok8 hui1 siong5 be7 song2 。 
282, su7 au7 tshue7 bo5 tioh8 tshing3 ， 
283, ma7 si7 i2 i1 ui7 ing5 。 
284, ue7 bian2 kuan3 kun1 sing5 kong1 ， 
285, tsa1 bo2 gin2 a2 tok8 tsu7 tsau2 kau3 lau7 pe7 kang1 tsok4 te7 tiam2 hu3 kin7 e5 thiok4 tsui2 ti5 tshit4 tho5 ， 
286, tse3 pai3 uan5 liau2 au7 bin5 tsiong3 bo5 tsah4 tng2 khi3 ， 
287, thai3 iau2 loh8 kok4 to7 hai2 sun5 tui7 uan5 tian1 to3 hiang3 jiok4 leh4 tsau2 
288, suah4 bue2 suah4 ai3 pi7 tsa1 tsip4 tshu3 huat8 ， 
289, hu7 tshin1 tsiat4 tng1 kang1 ， 
290, bin5 si7 sin1 bun5 po3 to7 
291, sin1 khu1 ting2 giam7 tshut4 e5 DNA uan5 a7 ham5 ki2 jin5 bo5 bo5 kang7 ， 
292, m7 koh4 tshut4 pau1 e5 tsit4 tai5 tshia1 ， 
293, m7 koh4 sing1 uah8 hui3 iong7 iau2 si7 siu1 put4 tsiok4 khai1 。 
294, tsi3 tsio2 u7 tsap8 it4 e5 lang5 si7 moo7 mia5 e5 tshing3 tshiu2 。 
295, hiam5 huan7 loh8 bang7 liau2 au7 ， 
296, hong1 thai1 kuan5 kau3 tsap8 ji7 kip4 e5 kiong5 hong1 ， 
297, phainn2 too5 tsiah4 ka7 tshia1 kiat4 ti7 ko1 sok4 kong1 lo7 kiu2 lu5 kau1 liu5 to7 ， 
298, to1 e7 koh4 tit8 koh4 tng5 ， 
299, tsong2 sng3 hoo7 kuan5 ti7 sim1 lai7 e5 tua7 tsioh8 thau5 pang3 loh8 ， 
300, tai5 uan5 e5 lik8 ling5 kho1 ki1 ki1 sut8 ling5 lik8 ， 
301, m7 koh4 mui2 pai2 long2 iau2 si7 e7 pi7 kam2 tong7 ， 
302, ma7 in1 ui7 be7 kham1 ko1 un1 hang1 pian3 hing5 ， 
303, ti1 ko1 liang7 i1 hi1 bang7 iann2 be5 in1 ， 
304, bin5 si7 sin1 bun5 po3 to7 
305, uann7 sin7 ji7 tsap8 ji7 ni5 ham7 kheh8 nng7 e5 le2 pai3 ting2 tioh8 te7 ji7 pai2 
306, tsit8 hun7 ki1 ki1 bit8 bun5 kiann7 tsi2 tshut4 ， 
307, thang1 kong2 si7 phua3 liau2 a3 tsiu1 ki3 lok8 。 
308, au7 lai5 hau7 hong1 tsa1 tshut4 ， 
309, m7 koh4 suah4 u7 sin1 pak4 tshi7 gi7 uan5 tsit4 gi5 ， 
310, hoo7 tsit4 mia5 sik4 long5 un3 tsiang3 khin1 kho2 thuat4 sin1 ， 
311, ui7 tioh8 tau3 sann1 kang7 kian7 po2 so2 khah4 tsok8 ， 
312, hian7 tsu2 si5 in1 ui7 hu2 suan2 kan3 poo7 siap8 hiam5 hue2 suan2 ， 
313, pat8 a2 tshiu7 i2 king1 ta1 si2 ， 
314, lai5 khuann3 sian1 ling1 sing1 san2 e5 sing5 pun2 khi2 hok4 ， 
315, m7 na7 kho2 giam7 tioh8 tshi7 hu2 kuann1 uan5 e5 ti3 hui7 ， 
316, kui1 e5 kue2 tsi2 hng5 sun2 sit4 tshiau1 kue3 sann1 siann5 kau3 goo7 siann5 ， 
317, tsit4 lai7 bin7 sim7 tsi3 iau2 u7 kok4 tse3 ti1 bing5 phin2 pai5 ， 
318, tsit4 kiann7 king2 hong1 kap4 po3 be2 a2 tso3 hue2 kong3 tsoo2 thau5 lian2 kiau2 a2 tsinn5 ， 
319, kiat4 tsi2 lui2 lui2 e5 tshenn1 phue5 phong3 kam1 ， 
320, tsah4 tioh8 tua7 pau1 se3 pau1 hing5 li2 ， 
321, kong1 si1 tsu7 koo2 i2 lai5 kap4 giap8 bu7 long2 si7 sing5 lam2 kuan1 he7 ， 
322, kan1 na1 lan5 san1 e5 tsit8 tsiah4 、 nng7 tsiah4 ， 
323, tsit4 ma2 bo5 lun7 kau2 si7 m7 si7 kian7 khong1 ， 
324, pau1 kuat4 tai5 uan5 tsun5 tiunn2 tsai7 lai7 iau2 u7 nng7 lang5 sit4 tsong1 。 
325, tai7 sing1 bo5 sin1 tshing2 tiunn5 te7 ， 
326, tong7 po2 huat4 i2 king1 kui1 ting7 kim3 tsi2 su2 iong7 liah8 siu3 ngeh8 ， 
327, ti3 su2 tai5 uan5 giap8 tsia2 tsiap4 be7 tioh8 ting3 tuann1 。 
328, tsit4 lui7 e5 sin5 ke1 pi2 sai3 uah8 tang7 ， 
329, tu2 ti7 leh4 tsin3 hing5 thun7 hai2 tso7 te7 ， 
330, thinn1 ting2 hun5 suann2 jit8 tshut4 ， 
331, sim7 tsi3 tshua7 thau5 ui5 huat4 luan7 kiat4 hun1 sai2 ， 
332, be2 e5 kue2 tsi2 tioh8 si7 king1 tsio1 。 
333, koo2 ke3 nng7 pah4 kong1 khing2 e5 tshai3 thau5 siu7 tioh8 ing2 hiang2 ， 
334, tsit4 m7 si7 king2 tshat4 kiok8 ti7 khui1 bak8 kiann3 kiann5 ， 
335, ti7 san2 siau1 ham5 ke3 siau3 bun7 te5 e5 tsha1 ki7 ha7 ， 
336, poo7 tui7 tsun2 pi7 e5 tsa2 tng3 pau1 kuat4 sa1 la2 nng7 ， 
337, pai3 jit8 ti7 i1 e5 tsoo2 ke1 tai5 lam5 tshit4 koo2 ki2 hing5 ko3 piat8 le2 pai3 。 
338, giap8 tsia2 kai2 sueh4 tshiok4 siau1 si5 kan1 kiat4 sok4 0ah4 ， 
339, ng5 sik4 gu5 phue5 tsua2 te7 a2 ting2 thau5 sia2 tioh8 ji7 tsap8 ji7 ban7 kau2 tshing1 goo7 pah4 khoo1 ， 
340, si1 tiu5 ti7 siau3 lian5 sin1 tshong3 i3 tsi1 ha7 ， 
341, ti7 hau7 hng5 phian1 mng5 than3 tioh8 hak8 sing1 hong3 hak8 tso3 sing1 li2 ， 
342, gin2 a2 phah4 bo5 mih8 kiann7 ， 
343, hit4 si5 tsun7 ko1 le5 tshai3 tsa2 to1 hu2 pai7 。 
344, pun2 sin1 tioh8 si7 tsit8 mia5 thong1 tship4 huan7 。 
345, suan2 tshut4 u7 tshong3 i3 e5 tsng1 hia7 、 hui5 a2 tse3 phin2 phuann7 tshiu2 tsok4 phin2 。 
346, tsing5 soo1 hong1 pho1 tshua3 ing1 bun5 hoo1 iok8 su1 huat4 tiau1 tsa1 
347, am3 si5 peh4 tiam2 gua7 liok8 siok8 tsiap4 tioh8 tsiong1 tsi2 hap8 iok4 tian7 ue7 。 
348, m7 koh4 tong7 but8 hong5 ik8 tsuan1 ka1 piau2 si7 ， 
349, lui2 tsik4 tsinn5 giah8 tshiau1 kue3 nng7 ik4 。 
350, in1 bo5 si5 kan1 kue3 pong7 kiam2 tsa1 ma7 tsin1 bo5 nai7 ， 
351, senn1 lik8 e5 kue1 a2 hioh8 tsi1 kan1 ， 
352, tue3 bue2 sing5 lok8 bi7 lai5 si3 ni5 lai7 ， 
353, e7 sai2 uan2 thiau3 goo7 pah4 kong1 tshioh4 i2 gua7 e5 sio2 na5 tshuan1 ui5 tsi2 。 
354, kin1 ni5 e5 ko1 hiong5 ting1 hue7 ， 
355, tsa1 boo2 kiann2 tih4 beh4 kiat4 hun1 phue3 ti3 e5 ng5 kim1 phuah8 lian7 ， 
356, tsit4 ma2 su1 iau3 ke1 khai1 tsit8 kua2 a2 tsinn5 。 
357, tshing7 tioh8 kam1 a2 ang5 gua7 tho3 e5 senn3 ng5 tsa1 poo1 tai7 hak8 sing1 ， 
358, tua7 phe1 iu5 kheh4 kap4 tsai7 te7 bin5 tsiong3 tsuan5 poo7 khueh4 leh4 tso3 hue2 ， 
359, tsing1 tsa1 tui7 uan5 king2 ka1 siang7 hat4 khu1 phai3 tshut4 soo2 king2 lik8 ， 
360, sann1 ho7 tsa2 khi2 li5 khui1 ko1 hiong5 kang2 si5 tsun7 ， 
361, tsit8 pai5 i2 king1 phua3 khi3 e5 phong3 i2 。 
362, mua2 toh4 e5 bun5 tshong3 san2 phin2 ， 
363, pi7 bian2 tso7 sing5 khuan5 king2 siong1 hai7 khok4 tua7 ， 
364, tua7 poo7 hun7 i2 king1 pi7 kai2 pho2 tso3 kui1 te3 e5 ， 
365, hoo7 ka1 siok8 siam2 be7 tik8 hu3 。 
366, jiam2 tioh8 oo1 sik4 iu5 kau2 siang1 tong1 khun3 lan5 tshing1 li2 。 
367, kin7 ki7 li7 e5 kam2 siu7 tai5 uan5 guan5 tsu7 bin5 e5 bun5 hua3 e5 sui2 ， 
368, siang7 bue2 khui1 kau3 pong7 lian2 e5 lun5 thai1 ， 
369, huat4 guan5 hong1 bin7 tsiah4 u7 i1 ki3 。 
370, hoo7 siunn7 beh4 pue1 e5 bang7 siong2 lu2 lai5 lu2 iong5 i7 。 
371, guan5 lai5 tsit4 si7 tsa3 phian3 tsip8 thuan5 kuan3 iong7 e5 tshiu2 huat4 。 
372, tsuan5 a3 tsiu1 kui1 boo5 siang7 tua7 e5 tsuan1 giap8 sit8 phin2 tian2 ， 
373, tsit4 si7 tsuan5 jit8 pun2 te7 it4 e5 te7 ha7 ha7 tsui2 kau1 ， 
374, ti7 tong5 giap8 kui1 phiann2 tshenn1 phiang3 phiang3 e5 siu7 e5 siu7 ， 
375, hiong1 kong1 soo2 tsun2 pi7 khue1 hok8 guan5 pun2 e5 ki1 ling5 ， 
376, sit8 tse3 tan1 ke3 tsit8 tshing1 khoo1 e5 thak8 tsheh4 i2 toh4 ， 
377, au7 lai5 sui1 jian5 e7 tit4 hu3 huat4 hian7 ， 
378, guan5 lai5 senn3 tsng1 tsa1 poo1 tse7 pai2 kho2 ka3 tsiau3 sit4 li7 ， 
379, hiang3 lip8 ui2 tin5 tsing5 khau3 tau5 kang1 si5 tshiau1 tng5 ， 
380, kuann1 tsong7 piau2 bin7 ma7 tng2 tso3 ping5 tshia1 tshia1 。 
381, ka1 lok8 tsui2 hong1 king2 khu1 ma7 si7 mua2 tsiu1 hiong1 e5 kim1 ke1 bo2 ， 
382, bok8 tsian5 ti7 ko1 hiong5 kam3 li2 soo2 tso3 sit4 e5 tshing1 kiat4 a1 sang2 lim5 iam7 tsu1 ， 
383, tsit4 ma2 thuan5 tshut4 tiau5 khi2 phio3 ke3 e5 siau1 sit4 ， 
384, khi2 ke3 tso7 sing5 bin5 tsiong3 kiam2 tsiah8 tsit8 kua2 a2 e5 tshik4 liak8 ， 
385, bin7 tui3 bin5 tsiong3 theh8 tshut4 ian5 tshiunn2 e5 soo3 kiu5 ， 
386, tong1 si5 i1 tu2 ho2 khui1 tshia1 king1 kue3 ， 
387, tso7 sing5 tshiu2 ki1 tsim3 phau3 ti7 hong5 bang2 ik4 lai7 bin7 kui1 me5 ， 
388, siang7 tua7 e5 bun7 te5 tioh8 si7 tsiann5 tso3 bin5 tsiong3 e5 kue3 bin2 guan5 。 
389, bin5 si7 sin1 bun5 po3 to7 
390, tsiann5 tse7 khia7 ke1 in1 ui7 tsit4 pai2 e5 thiau3 tian7 i3 gua7 ， 
391, kuann2 kin2 phah4 tian7 ue7 hoo7 it4 it4 khong3 huah4 kiu3 lang5 ， 
392, tang1 sua1 to2 ki7 li7 ko1 hiong5 tshi7 si3 pah4 goo7 tsap8 kong1 li2 ， 
393, hi1 bang7 gi7 uan5 tok4 tshiok4 tsing3 hu2 tan1 ui7 e7 thang1 tsin7 khuai3 kai2 sian7 ， 
394, loh8 tioh8 hoo7 phang1 long5 iau2 si7 thau3 hoo7 tshiunn2 leh4 tshai2 siu1 phang1 bit8 ， 
395, hing1 kian3 ti7 tshing1 tiau5 khian5 liong5 ni5 kan1 ， 
396, guan5 lai5 kuan1 bio7 ong5 lai5 kap4 kuan1 bio7 mi7 ， 
397, tua7 liang7 tsin3 hue3 liau2 au7 tue3 bue2 tsiu7 put4 kian3 lang5 iann2 。 
398, bin5 si7 sin1 bun5 po3 to7 
